{
  "form_type": "lettings",
  "start_year": 2021,
  "end_year": 2022,
  "sections": {
    "household": {
      "label": "About the household",
      "subsections": {
        "household_characteristics": {
          "label": "Household characteristics",
          "pages": {
          }
        }
      }
    }
  }
}
            